{
  "versao": "1.00",
  "cOrgao": 91,
  "chNfe": "35191200000000000000550010000012345678901234",
  "tpEvento": "110111",
  "nSeqEvento": 1,
  "xEvento": "Cancelamento",
  "dhEvento": "2021-03-11T10:20:05Z",
  "dhRecbto": "2021-03-11T10:20:09Z",
  "nProt": "135210000654321",
  "cnpjEmit": "12345678000190"
}
